{
  "$schema": "https://json-schema.org/draft/2020-12/schema",
  "$id": "https://agmind.local/contracts/v1/event-envelope.schema.json",
  "type": "object",
  "additionalProperties": false,
  "required": [
    "schema_version",
    "event_id",
    "event_type",
    "source_id",
    "source_version",
    "key_id",
    "key_epoch",
    "host_id",
    "boot_id",
    "source_sequence",
    "event_time",
    "ingest_time",
    "clock_uncertainty_ms",
    "inventory_generation",
    "normalized_fields",
    "normalized_fields_sha256",
    "redaction_flags",
    "coverage_flags",
    "source_payload_hash",
    "source_signature"
  ],
  "properties": {
    "schema_version": {
      "type": "string",
      "const": "agmind.event-envelope.v1"
    },
    "event_id": {
      "type": "string",
      "pattern": "^evt_[0-9a-f]{64}$"
    },
    "event_type": {
      "type": "string",
      "minLength": 1,
      "maxLength": 64,
      "pattern": "^[\\x20-\\x7e]+$"
    },
    "source_id": {
      "type": "string",
      "minLength": 1,
      "maxLength": 512
    },
    "source_version": {
      "type": "string",
      "minLength": 1,
      "maxLength": 64,
      "pattern": "^[\\x20-\\x7e]+$"
    },
    "key_id": {
      "type": "string",
      "pattern": "^[0-9a-f]{32}$"
    },
    "key_epoch": {
      "type": "integer",
      "minimum": 1,
      "maximum": 18446744073709551615
    },
    "host_id": {
      "$ref": "#/$defs/uuid4"
    },
    "boot_id": {
      "$ref": "#/$defs/uuid4"
    },
    "source_sequence": {
      "type": "integer",
      "minimum": 1,
      "maximum": 18446744073709551615
    },
    "event_time": {
      "$ref": "#/$defs/timestamp"
    },
    "ingest_time": {
      "$ref": "#/$defs/timestamp"
    },
    "clock_uncertainty_ms": {
      "type": "integer",
      "minimum": 0,
      "maximum": 2000
    },
    "container_id": {
      "type": "string",
      "pattern": "^[0-9a-f]{64}$",
      "description": "Observer-authoritative full Docker container ID after exact running-container resolution."
    },
    "container_start_time": {
      "$ref": "#/$defs/timestamp",
      "description": "Observer-authoritative Docker State.StartedAt value, never the Falco sensor timestamp."
    },
    "release_id": {
      "type": "string",
      "pattern": "^rel_[0-9a-f]{32}$"
    },
    "inventory_generation": {
      "$ref": "#/$defs/uint64",
      "description": "Durable observer-wide generation of the full redacted Docker inventory."
    },
    "inventory_revision": {
      "$ref": "#/$defs/uint64",
      "description": "Durable per-container revision of the selected authoritative identity fields."
    },
    "normalized_fields": {
      "$ref": "#/$defs/boundedObject"
    },
    "normalized_fields_sha256": {
      "$ref": "#/$defs/sha256"
    },
    "redaction_flags": {
      "$ref": "#/$defs/flags"
    },
    "coverage_flags": {
      "$ref": "#/$defs/flags"
    },
    "source_payload_hash": {
      "$ref": "#/$defs/sha256"
    },
    "source_signature": {
      "type": "string",
      "pattern": "^[0-9a-f]{128}$"
    }
  },
  "$defs": {
    "uint64": {
      "type": "integer",
      "minimum": 0,
      "maximum": 18446744073709551615
    },
    "sha256": {
      "type": "string",
      "pattern": "^[0-9a-f]{64}$"
    },
    "uuid4": {
      "type": "string",
      "pattern": "^[0-9a-f]{8}-[0-9a-f]{4}-4[0-9a-f]{3}-[89ab][0-9a-f]{3}-[0-9a-f]{12}$"
    },
    "timestamp": {
      "type": "string",
      "format": "date-time",
      "pattern": "^(?:[0-9]{3}[1-9]|[0-9]{2}[1-9][0-9]|[0-9][1-9][0-9]{2}|[1-9][0-9]{3})-(?:0[1-9]|1[0-2])-(?:0[1-9]|[12][0-9]|3[01])T(?:[01][0-9]|2[0-3]):[0-5][0-9]:[0-5][0-9](?:\\.[0-9]{1,9})?Z$"
    },
    "flags": {
      "type": "array",
      "maxItems": 64,
      "uniqueItems": true,
      "items": {
        "type": "string",
        "minLength": 1,
        "maxLength": 64,
        "pattern": "^[\\x20-\\x7e]+$"
      }
    },
    "boundedValue": {
      "oneOf": [
        {
          "type": "null"
        },
        {
          "type": "boolean"
        },
        {
          "type": "integer",
          "minimum": -9223372036854775808,
          "maximum": 18446744073709551615
        },
        {
          "type": "string",
          "maxLength": 8192
        },
        {
          "type": "array",
          "maxItems": 128,
          "items": {
            "$ref": "#/$defs/boundedValue"
          }
        },
        {
          "$ref": "#/$defs/boundedObject"
        }
      ]
    },
    "boundedObject": {
      "type": "object",
      "maxProperties": 128,
      "propertyNames": {
        "maxLength": 512
      },
      "additionalProperties": {
        "$ref": "#/$defs/boundedValue"
      }
    }
  }
}
