{
  "schema_version": "agmind.event-envelope.v1",
  "event_id": "evt_5ca264c47eb4ca4cf63114dba860fb95179167fcd0674d5d976a15c9e7473e98",
  "event_type": "falco.connect.v1",
  "source_id": "falco-adapter",
  "source_version": "0.44.1",
  "key_id": "56475aa75463474c0285df5dbf2bcab7",
  "key_epoch": 1,
  "host_id": "123e4567-e89b-42d3-a456-426614174000",
  "boot_id": "123e4567-e89b-42d3-a456-426614174001",
  "source_sequence": 7,
  "event_time": "2026-07-27T12:00:00Z",
  "ingest_time": "2026-07-27T12:00:01Z",
  "clock_uncertainty_ms": 5,
  "inventory_generation": 2,
  "normalized_fields": {"destination_ipv4": "1.1.1.1", "evt_type": "connect"},
  "normalized_fields_sha256": "5649d1f7363c811a5e4de8b8e33cbdadca3b52cfadbf487ed1c6cdc3e99449d5",
  "redaction_flags": [],
  "coverage_flags": [],
  "source_payload_hash": "1111111111111111111111111111111111111111111111111111111111111111",
  "source_signature": "9b43b8c6caa7ded06ce3f42df420cd6a3d959cd083007794a59d660e3272f67aea277880a7c41eaf4cf60b9d05a1865b16a176220627f1c790a8dd37fdbbb809"
}
